<?xml version="1.0" encoding="UTF-8"?>
<curation-states xmlns:xsi="http://www.w3.org/2001/XMLSchema-instance" xsi:noNamespaceSchemaLocation="http://localhost/camod/config/CurationConfig.xsd" >
	<state default="true">
	 	<name>Complete-not screened</name>
	    <actions>
		    <action>emailAssignee</action>
		</actions>
		<next-valid-states>
		    <next-valid-state>
		        <name>Screener-assigned</name>
		        <match-event>assign_screener</match-event>
		    </next-valid-state>
		</next-valid-states>
	</state>
	
	<state default="false">
	 	<name>Screener-assigned</name>
	    <actions>
		    <action>emailAssignee</action>
		</actions>
		<next-valid-states>
		    <next-valid-state>
		        <name>Screened-approved</name>
		        <match-event>screener_approve</match-event>
		    </next-valid-state>
		    <next-valid-state>
		        <name>Screened-rejected</name>
		        <match-event>screener_reject</match-event>
		    </next-valid-state>
		</next-valid-states>
	</state>
	
	<state default="false">
	 	<name>Screened-approved</name>
	</state>
	
	<state default="false">
	 	<name>Screened-rejected</name>
	</state>
</curation-states>